{
  "id": 10,
  "container.type": "dashboard",
  "visualization.name": "Monitor Uptime - Availability Chart",
  "visualization.description": "Monitor uptime percentage over time",
  "visualization.granularity": "10 m",
  "visualization.timeline": {
    "relative.timeline": "today"
  },
  "visualization.category": "Chart",
  "visualization.type": "Line",
  "visualization.data.sources": [
    {
      "type": "availability",
      "filters": {
        "data.filter": {},
        "result.filter": {},
        "drill.down.filter": {}
      },
      "data.points": [
        {
          "data.point": "monitor.uptime.percent",
          "aggregator": "avg"
        }
      ]
    }
  ],
  "visualization.properties": {
    "chart": {
      "line.width": 2,
      "chart.legend": "yes",
      "chart.label": "yes",
      "axis.titles": {
        "x": "Time",
        "y": "Uptime (%)"
      },
      "marker.property": [
        {
          "marker.type": "line",
          "marker.threshold": 95,
          "marker.color": "WARNING",
          "marker.line.type": "dash",
          "marker.label": "Warning (95%)"
        },
        {
          "marker.type": "line",
          "marker.threshold": 90,
          "marker.color": "CRITICAL",
          "marker.line.type": "solid.bold",
          "marker.label": "Critical (90%)"
        }
      ]
    }
  },
  "visualization.result.by": ["monitor"]
} 